,Unnamed: 0,tweet,label
4164,1121,biriya sibyawe jyubiharira ababishoboye  wowe aho guhagararira igihugu waki carira ,0
4165,1244,premier league mwana umuntu amenya ibyavuye mu mukino ari uko umusifuzi ahushye mu ifirimbi ibindi tuge twicecekera dutegereze ,1
4166,400,swiyimbeleri ahi yeni  miva byela ku hina hi tiva ndlelasenya retla patela  mozambique ,1
4167,1284,habarinitaaluma muswada wa huduma za habari unalenga kuigeuza sekta ya habari kuwa taaluma kamili na itakayoheshimika z,2
4168,968,dogo baba mi siendi tena shule inaonekana walimu hawana uhakika na majibu yao baba kwanini unasema hivyo dogo juzi walisema   jana wakasema  halafu leo wanasema  sasa huoni kama wanatuchanganya,1
4169,711,leo tena leo hii kwenye masimulizi ya juzi jana na leo anasikika msanii kenny kenie toka kwanza record forest,1
4170,1138,ndiyo iwapo umetuma pesa kimakosa inaweza kurudishwa kwenye akaunti yako vicky,1
4171,1785,gyslain muri iyi minsi  ,1
4172,1671,kikubwa nilichojifunza katika elimu ni kwamba walimu wanakusaidia ufauli mitihani ila kuelewa na kuchambua kipi unahita,2
4173,239,famba ti kundza ,0
4174,136,woga burimunsi se uri unugore mn,0
4175,1201,alhamdulilah naomba ifike na selous na mikumi yaani hali ya wanyama inaskitisha sana,1
4176,533,nguvu za kiume na tikiti maji tikiti maji ni tunda ambalo kitaalamu tunaliita citrullus lanatus,1
4177,1899,gahunda ni uguheka ku nda nyine undi ugafata akaboko,1
4178,707,teka famba bro ,2
4179,2427,leta yurwanda numubyeyi kbs itabaye abantu baribaraye batageze aho baba muri kigali ,2
4180,1963,ibigaragara nuko iswime yanjye nayiteye ipasi saa tanu nigice nyuma ya match nibwo irakora ibyayo,1
4181,1374,bkabla watu awajakufollow lazima wangalie profile yako weks profile ambayo inaeeza kuvutis watu kukufollow cbio tengeneza bio ambayo inaonyesha watu wanaweza kujifunza kitu kupitia wewe mfano wa bio isiokuwa na mvito nna miaka  nakaa mbagala nasomea ufundi,2
4182,2156,natwe abatagira amahirwe yo kumva radio mujye mutuzirikana kuri liens tubisangaho,1
4183,591,kuki usanga abitwa ba kavukire batumvikana nabitwa abimukira ndetse ugasanga abapangayi batumvikana na ba nyiramazu bakodesha ,0
4184,2941,fibawcq  q rwanda    south sudan q tuyikinnye nka gsw amanota  bakora amanota  gusa bravo    fm ,2
4185,2222,ko intangiriro yubunebwe arukunyurwa ubundi unyurw ute ,1
4186,1905,kariakooderby ht yanga sc simba sc uri gufana iyihe simplysports ,1
4187,720,ni cizi weni unga buyi ni taku ,2
4188,1444,njye nguha report se ubwiwe niki ko ho ntahageze,1
4189,2877,umunsi mwiza mwese mukomeze guhirwa mu kazi mukora mwibukeko n uwiteka yavuzeko azaha imigisha y amaboko yacu rwanda rwot rwotgain rscposter burundi azimiolaumoja airdrop anonymous ccc ashewovibes ,2
4190,1766,dear ladies vaeni pete kwenye kidole kile cha ndoa hii inapunguza kasi ya mafisi kuwasumbua,2
4191,986,nkubu  akaza gukorere concert mu rwanda  yaryama muri kaburimbo ,0
4192,2901,uyu munsi nta ntambara yadutera ubwoba ntayo kwibohora inkotanyiniubuzima mwarakozeinkotanyi rwanda rwot futureperfect ,2
4193,406,xilo ndla yin ni kayerini,1
4194,90,wa nsila lweyii  damnnnnnnn,0
4195,3005,muturi imbere tubari inyuma haki ya mungu turikumwe  koresha iyi hashtag turikumwe ushyigikire ikipe yacu ikina none  na kenya ,2
4196,2117,maybe ni muri ur huye campus,1
4197,1247,anasema kuvuka mia kukanyaga mavi bure,1
4198,3032,siwumvako nge nawe turi aba kristu ,2
4199,995,npo mbele ya hio bajaji ukifika utaniona nmvaa viatu vya kijani na suruali nyekundu na shat la buluu na kofia nyeus,1
4200,2458,u rwanda ninkawe rukeneyekwitura uwakugiriye neza ni ingenzi mubuzima komeza ujye mbere mwenimanakdi imana yi  ikomeze kukwitura weforkagame ,2
4201,852,kama kuna mtu anafahamu jina la movie hii naomba anisaidie,1
4202,450,unfortunately ur dm is not open kandi narintangiye kubwira umwana uti simbuka unzanire kamwe sh kuri butike,0
4203,1867,wararira amazi gusa ubwo,1
4204,828,ubu tuvugana ntahantu nahamwe arsenal yajya tuyihe luvumbu se niwe wenyine wayikuraho,0
4205,1911,banza police yari employinze umuntu ukora muri registration ya auca,1
4206,1849,ubuhamya bwa dr rwigema pierreclestin wabaye ministri wintebe nyuma ya jenoside yakorewe abatutsi   ,1
4207,2454,fata umwana wese nkuwawe ,2
4208,799,teka famba ya man  te amo ,2
4209,2876,nakomeza nkiyicarira bose nkabihorera aho kugirango ngire uwo ntera ishyari ,2
4210,1169,mwananchi alhamisi novemba  ,1
4211,143,wabunge wa upinzani isipokuwa baadhi ya wa chama cha wananchi cuf kambi ya ibrahim lipumba wamesusia zoezi la kuapishwa wabunge wanne wa chama cha mapinduzi ccm waliochaguliwa hivi karibuni,0
4212,2174,amakuru atariho umukungugu ni uko tariki ya mbere next month uzaba wemerewe kunyicaza ahantu nkagutega yombi,1
4213,199,utah ni dlaya salubri ,0
4214,3296,bigogwe we icyo usabwaubundi nkagukorera ibyiza gusa  ,2
4215,157,uyu munsi nabeshye landlord ikinyoma gikomeye ariko umenya birankoraho foolsday,0
4216,2611,mwaramutse mwadufashije mugahangana nababateka mutwe uyu yampamagaye aherereye muri  byangabocentre mumukurikiranye byaba byiza kuko yakomeza gushuka beshi murakoze ,2
4217,1100,bashite somaga haya maana siku meko anaanguka tunaanza na lile hekalu kule igoma,1
4218,207,ubukungu bwazahaye kuri wowe utari ufite erega banza urebe imiturirwa yirirwa izamuka buri munsi ese izamurwa namagambo gusa,0
4219,457,u tsika mova kaya namunthla ,2
4220,3003,umuyobozi wa undp mu rwanda bwana maxwell gomera yashimishijwe cyane no kurebana umupira na perezida kagame ,2
4221,519,idini ryigisha kureka icyaha ntabwo ndyita iry ukuri kuko ribs ribizi neza ko bidashoboka,0
4222,2314,kuri uyu wa   nyabugogocell hizihijwe umunsi w abafite ubumuga intego yagiraga iti imiyiborereidaheza uburezibudaheza     ,1
4223,1769,ndumva nta kigoye kirimo kwandika email no gutegereza igisubizo gusa,1
4224,1730,abayobozi bakarere bungirije bombi nabakozi bakarere bakiriye umuvunyi mukuru  wasuye akarere muri gahunda yo gukurikirana ibibazo byabaturage byagejejwe rw        ,1
4225,1366,taarifa dkt hassan abbasi ataendelea kuwa msemaji mkuu wa serikali hadi pale atakapopatikana msemaji mkuu mwingine,2
4226,1822,uyu munsi ntimucikwe na artbuzz ku izubatv hamwe na    turaza kuba turikumwe na  saa   kigali rwanda ,1
4227,296,reba inyinya ariel wayz afite aramutse nkubu abyaranye na juno kizigenza nawe niriya nyinya nibabyara umwana utagira amenyo koko,0
4228,809,mwakwihanganye mugashaka printer ibikora neza hamwe na scanneur ko biba bitagaragara neza ,0
4229,131,x lava kunha s mara wa xi lumbeta,0
4230,3087,mwese bantu ba hano ijoro ryiza maze nyagasani abitehoamahoro mwese,2
4231,178,urikigoryi niba ufana indaya zishaje,0
4232,1654,jitihada za kufikia mpango wa dunia wa malengo endelevu unahusisha uchumi jumuishi na ubunifu umechukua nafasi kubwa katika,2
4233,1562,pamoja sana endelea kutumia huduma zetuka,2
4234,1731,happy bi hday kwangu mimi na kwa  mungu atusaidie tuishi miaka kama yote h,2
4235,435,aidha amesema nmb inafanya kazi pamoja na wilaya na halmashauri zote nchini ikiwa ni pamoja na kutoa mikopo rafiki kwa wafanyakazi wa serikali,1
4236,826,mkurugenzi mtendaji wa benki ya equity t robert kiboti kesho saa tatu asubuhi atakuwa live katika akaunti zetu za inst,1
4237,1106,eneo lako wilaya yako na mkoa wako,1
4238,184,ngo cyahinda  shaka ahandi uvugaindashyikirwa imodoka itarimo  se twayicaramo ,0
4239,2421,police turayishimira imbaraga ubushishozi ikoresha mugufata abakekwaho ubujura mukomereze aho,2
4240,336,my point is akitaka mimba huwezi kupanguaatakwambia yuko safe kumbe ni danger calendar ilishabadilika na haujui,1
4241,297,unatumia premier bet kuweka mikeka yako ungependa kupata maoni au mawazo kabla ya kupandisha mkeka njoo kwenye gr,1
4242,2766,umunsi nabaye mama ntawunzansimbura ku bana banjye so i only have to wait,2
4243,3174,abo bireba mwese ndabasuhuje kandi ndabemera cyane peumunsi mwiza valentinesday rwot rwotgain ,2
4244,251,edj  aloko niku amp ni biwa hi zululuane ,0
4245,1575,bnbsports imikino yigikombe cyamahoro iratangira kuri uyu wa  hakinwa imikino ibanza simplysports ,1
4246,11,ni akazi kawe nubunywa ugatwara breathalyzer ikagufata ntuzagire ngo akamaarimaari ntikakuburiye,0
4247,3217,urakoze cyane ubwo washimye imikorere ya  ubwo nimirimo ya  yahawe agaciro,2
4248,574,lakini pia tuliweza kuwarudishia fidia ya vifurushi vyao wateja waliyojiunga na kushindwa kuvitumia kwa siku husika na pia vilidumu ndani ya masaa  ahsante wn,1
4249,1143,oya nonese gusaba amafaranga no gusambanya abana uri kubigereranya ,0
4250,2646,abafana bitabiriye umuvurederby umwe mu mikino yirushanwa riri gufasha mu bukangurambaga bwo kurwanya ibiyobyabwenge mbisubiremo   rwot  ,2
4251,2728,mwarakoze kumfasha kwirema aho kwiremaza muri ingenzi mu buzima bwa benshi mbakeshaubuzima mfite ubu happyday ,2
4252,557,ku ta faciwa swa bom,2
4253,2964,umusaza ninawe waduhaga show kera mu muziki akazana ibyamamare bivuzeko za gishuti zamavubi zajya ziba zikaze,2
4254,670,ikibazo cyamafaranga make muri  kuri branch ya pensionplaza kubikuza m bisaba gutegereza kohari ukora versement rwot,0
4255,483,youtubers rn baguwe gitumo bari kunywa urumogi ba banyamakuru mukunda cyane ,0
4256,1373,injira weekend ugurira umwana igitabo cyo gusoma rwot visitrwanda rwanda,1
4257,45,wali wa dula  ,0
4258,1677,kilimo kinaweza kuajiri vijana wengi wasio na kazi ilisaidia kukamilishwa mkakati wa taifa wa kushirikisha v,2
4259,2465,mu mana biremera wanjye ngaho niba utari umupagani shima imana kandi utagenda utagize icyo uvuga urakoze nyagasani amen ,2
4260,2885,gahunda niyi umuco wacu ishema ryacu ntucikanwe ngwino nawe umenye ibyiza bitatse bigogwe  visitrwanda visitbigogwe ,2
4261,2608,kubindi sinshyigikiye ikibi namaganye genocide ningengabitekerezo yayo ntibizongere mu rwanda nahandi hose,2
4262,29,umuyobozi nshaka rapport yabapfakazi mu kagari uyobora kanyana abapfa mukagari nyobora ni ,0
4263,29,wanafunzi wenye ulemavu wakwamishwa na miundombinu lindi klik,0
4264,1129,ntugate umwanya wae wigisha cg uhanura udashaka guhinduka  kuko ntibishoboka ko wahindura umuntu mudahuje imico,0
4265,595,ubwose iyo zabarizawe kontumva twari nokubura abanyeshuri,0
4266,5,very sad umwana wukwezi  koko nyamara izi nyagabirama ziba zifite uburwayi bwo mumutwe ntamuntu muzima wakora aya mahano ,0
4267,355,xa ku txukatxukanhana mas a keheleeeee  ,1
4268,1046,ni wajibu wa serikali kusomesha kila mtoto kwa elimu bora na bure bila ubaguzi sisi tutabana mpk atalipa,1
4269,3252,nyamara uzaba utumye twiyongerera agafumbire mu murima,2
4270,2747,humura muvandimweimana izi umubyeyi wawe cyane kdi iraje imukize,2
4271,2196,perezida kagame ageze kuri club rafiki ahagiye gufungurwa ku mugaragaro ikibuga cya basketballrbaamakuru ,1
4272,793,bikwirakwiza kovidi bikanagusaba kishyura menshi ngo umucuruzi bazamukata mu kuyabikuza bikanabangamira gahunda ya leta yo guteza imbere cashless economy  ,0
4273,527,chapati  supu na soda billi imekuja  na mfukoni nina elfu  nifanyaje ndugu zangu,1
4274,920,byabanyarwanda bafite ibibazo byo mumutwe gute ikariso igurwa k,0
4275,820,hari umukobwa wambwiye ngo iyo umunsi wije atabonye umugabo umureba ngo amukurikize ijisho amenya ko uwo munsi yambaye nabi,0
4276,1145,mabinti wengi wanashindwa kuhudhuria masomo wanapokuwa katika hedhi kutokana na ukosefu wa vihifadhi hedhi kwani wanahofia,1
4277,441,nkuyu aba ari mu biki,0
4278,511,tafadhali tujulishe tatizo lako kwa msaada zaidijb,1
4279,2502,amategeko ajyena ko umwana ari umuntu uri munsi yimyaka  ntabwo avuga umuntu udafite indangamuntu,2
4280,989,kuna swali huwa najiuliza ipi sentensi sahihi sina pesa au hatuna pesa maana mfano halisi sherehe ya zuchu kiingilio mamilioni watu walikuepo wengi pambano la mwakinyo kiingilio mamilioni watu walikuepo tena kibao all in all t,1
4281,607,sinzi impamvu  inabi mu mvugo mu nyandiko mu ngirobikomeza guhabwa intebe mu buzima bwa benshi,0
4282,1338,umugaya iki se ange mwiza,1
4283,322,aho guta amafaranga yawe ugura inzira kumuntu uzagure bote unyute mubihuru,0
4284,380,leo mpaka alhamisi kuna hela kwa muhindi mimi nimetengeneza bomu hili linaitwa ngumu kumeza odds kubwa kubwa kama h,1
4285,1220,mbaza nkubaze amashushoyega ya ceasars messiah kuri youtube  yerekana ko yesu yahimbwe njye narumiwe pehari nigitabo cyabo banditse babigaragaza,1
4286,103,meko unaficha ficha vitu kwa kuwa ni mwizi kumbe ndani ya miaka mitatu unakopa wb halafu unakataza document zisiwe release,0
4287,808,this friday kwenye with heavyweight mc mbunge wa binadamu na wanyama hapa,1
4288,1622,nakupongeza ndg kwa kuchaguliwa tena kuwa mwenyekiti wa taifa nawapongeza wana chadema kwa kum,2
4289,452,kowagira ngo urumuhungu cg ubavukamo urumwe nibyo iyo ukabije  iya gatatu niyo kugutabara imvura yaguye,0
4290,1110,nizina abarwayi ni benshi  ,0
4291,323,ani nhlaya leswi ni swi vonaku,1
4292,958,asikumbie mtu ili uweze kujenga nyumba kali ni lazima uanze kuupiga mwingi kuanzia kwenye ramani ni wab,1
4293,505,hi ta humula guwa,2
4294,134,nem  wow kasi a ni ya kwini,0
4295,1498,waziri mkuu kassim majaliwa amesema ameridhishwa na kasi na viwango vya ujenzi wa mfumo wa reli ya kisasa sgr inayojengwa na kampuni ya yapi merkezi soma zaidi gtgt,2
4296,1098,tuko pamojatuendelee kuwa pamoja katika ukurasa wetu kwa habari zaidihm,1
4297,781,waziriwhusm mhedkt harrison mwakyembe akiwa katika picha ya pamoja na watendaji wa tbc mara baada ya kukamilisha ziara yake,1
4298,436,swa banana pah mas passamos na mesma,2
4299,641,lunch unapatia wapi kwenye menu yetu tuko na makange ya kukunyamasamaki kuku choma wali nazi ugalie ndizi mzuzu,1
4300,1599,uyu munsi ntumucikwe igitaramo cyo gusoma no kwandika  cyateguwe na  kubufatanye nabafatanyabikorwa       isango star tv  ,1
4301,1074,kiongozi wa chama cha  akiteta na mwenyekiti wa chama cha chadema wakati wa mapumz,1
4302,765,inzoga niba uziraramo ufite ikibazo aho kuziraramo zakuraramo,0
4303,1054,gahunda ariko ngo nuko uyu munsi ntamahoro agomba kuboneka ,0
4304,15,tumepokea kwa masikitiko makubwa taarifa za kuuawa kwa katibu wa chadema jimbo la manyoni mashariki bw alex jonas usi,0
4305,2814,sha nukuri urugero rwiza niwoe ark baba bavuga ukuri,2
4306,1804,ninde wundi wishumiraga gukora muri toilet zabarimu nkange,1
4307,2408,ndayakeneye ngo nyakoreshe umushinga kuko ndumva nshaka kugura ingurube nkayorora yambera igishoro gifatika ,2
4308,2562,uriya ntajya atenguha abantu be,2
4309,363,kkubera ko mbona mwanyihoreye kukibazo cyanjye nshaka ko muyemererako umunsi insinga zanyu zanteje impanuka muzabyirengera,0
4310,338,kasi mina se nilo onha yini ti tweets ta mina amihlayi vahaxi,1
4311,1807,uko abana baba x tuzajy tubakinisha mur danger gusa ,1
4312,929,nta mukozi ukoresh twitter ,0
4313,637,nina wena kola xokwe mozambique,2
4314,540,historicendtimerevival celebrando o senhor mikulunguana ka yesu alilililililililili alilililililililili alilililililililili alilililililililili ,2
4315,743,kila tatizo lina utatuzi wake,1
4316,985,sisi hatujakataa maharitunaongelea mahari kugeuzwa mtajimahari kubwa mnoo ndo hatutaki,1
4317,897,serikali kupitia kitengo cha urejeshaji wa mali zilizopatikana kwa njia ya rushwa imefanikiwa kuokoa zaidi shilingi bilioni  kutaifisha akaunti zenye thamani ya bilioni  pamoja na kushinda kesi  kati ya  soma zaidi gtgt,1
4318,767,nizina abarwayi ni benshi  ,0
4319,256,nheeee ni tsike ,0
4320,2259,nawe iyawe ndayizi fata umwaka wavutse mo ukure mo umwaka turi mo,1
4321,671,birababaje kuko kuyirandura ni hatari ibimenyetso no guceceka kwabayakwa nabayitanga biragoye cyane,0
4322,1665,pole kwa usumbufu ulioupata tulikua tuna tatizo la kiufundi katika huduma ya intaneti tumerejesha kifurushi chako na tulifanikiwa kuongeza mb kulingana na kifurushi ulichokua umenunua naomba kufahamu kama una changamoto katika huduma ya,2
4323,1615,abantu banakurikira uburyo yari yasobanuye ibindi hano ,1
4324,768,auxeni inlhikanili xile ku ndjani unga ni nhenhentsi ni bihile u shonguile wa nunwa a ni pfukanga kwatsi,2
4325,2606,turi amahoro ndizera namwe ari uko mugire umunsi mwiza birere,2
4326,275,air tanzania inawatangazia mabadiliko ya ratiba ya mapokezi ya kutoka us badala ya  j mapokezi yataf,1
4327,761,ni huma na marhama hey  khensa nsati wa mina wani hlayisa xem  ,2
4328,2023,situbumva turi mwishaymba rya kiyovu ahantu hamwe kur wakurongo wundi,1
4329,877,ndumva nkugiriye imbabazi gake twese ngo ntituresha pa sorry ,0
4330,354,ukikaa kwenye mvua unalalamika huna maji ya kunywa hayo matatizo unatafuta wewe mwenyewetanzania ina fursa nyingi  s,1
4331,148,tivha yini hi paixao wenaa ,0
4332,2512,nta kindi gihe urwanda rwaranzwe nubumwe ndetse no kureba imbere nkubu president paul kagame live now in  ,2
4333,3153,nyamara dufite abakinnyi benshi nta mpamvu yo kwangiza amafaranga tugura abandi,2
4334,2751,u rwanda rushya rwubatswe nubushake no kwigomwa birenze kamere kubyubahiriza ni igihango kubikinisha ni ishyano risama kwibuka ,2
4335,231,ndamugaye rwose ubwo bisobanuye ko umunsi wakoze ikosa abantu tuzagukuraho amaboko xbyo ,0
4336,1194,mchezo wa ligi kuu tanzania bara kati ya dhidi ya maji maji umemalizika katika,1
4337,1570,ubwose izo result ufite nizo aprfc ifite amanota atatu yatsinze kiyovusport kimwe kubusa,1
4338,879,parody hilo linaupiga mwingi,1
4339,283,aho mubona yica ni police yarihamusunitse arahagwa ,0
4340,248,eh eh eh ni livrari ,0
4341,107,hambi honi nhenha kassi wani nhenha wayi uni nhenha  mavelevele hustler ,0
4342,265,wala usiwabeuwe watuwala usitembee katika mgongo wa ardhi kwa maringohakika mwenyezi mungu hampendi kila anae jivuna,1
4343,2392,ariko se wa mugani ko twazibagiwe kdi ho niyo byanze bafata agakaramu bakandika,1
4344,221,hahahahaha yu yu yu yu wa hi danissa ,0
4345,21,mu batanteye agahinda ni bariya iyo umuntu ahisemo nabi arangiza nabi nyine ,0
4346,3193,nyagasani aguhe icyo umutima wawe umusaba gira umugisha      ,2
4347,1798,tufanye haya ili kuhakikisha sekta ya mawasiliano ya simu inaendelea kukua na kustawi,2
4348,790,waziri wa afya akikagua neti ya mmoja wa mama aliyejifungua hospitali ya rufaa ya mkoa wa mtwara ligula,1
4349,21,messi wa nhine ,0
4350,3240,amata aduhame kuko dufite imbaraga ndetse hamwe ninka za bigogwe zambaye apr,2
4351,936,wahisemo kuba ipede ngo nuko bakubwiye ko bagira amafaranga wemera gusebya abakubyaye toka kure wa kimbwa we,0
4352,2826,nubundi na tente zirubakwe hagatangirwamo service zubuzima runaka ark ikigo nderabuzima bisobanuye service zisumbuye kurizo uvuga,2
4353,657,je wajua  kama mtoto anaumwa mama anaanza kuzalisha maziwa yenye antibodies ili kumtibu mtoto,1
4354,594,a nina male minoooo noh tivha ku kina blazes voice,2
4355,227,famba ti nhela nilza  eh eh eh,0
4356,1414,pia fahamu ya kuwa tunafanya maboresho kwenye menyu zetu za vifurushi ili kuwapatia vifurushi bomba kabisa wateja wetu tafadhali piga  au  chagua saizi siku wikimwezi au halichachi kupata vifurushi vyetu vilivyobo,2
4357,237,menya itumba ryageze simbimenye ngo nkwikire isuka nshoke ibishanga ndaqkabaye,0
4358,850,utabiri wa hali ya hewa wa saa  zijazo kuanzia saa  usiku wa leo  kama unavyoletwa kwenu na mchambuzi joyce,1
4359,578,u bom mana tt ni yingiseli wena kola ka xokwe mozambique  ,2
4360,1392,man cyaze uransekeje pe iyi ni blague yumunsi  ,1
4361,1668,habari mpenda katika promotion hii ya sasa ya ujanja ni tunapenda kukujulisha kwamba tumefanya maboresho kwenye menyu yetu  au  ya vifurushi ambapo bado unaweza kupata vifurushi vya thamani ya pesa yako na saizi yako zaidi,2
4362,270,habari yako masoud hongera kwa kupata tiketi ya kucheza jackpot bure tunakutakia kila la kheri katika ubashiri wako pa,1
4363,3221,ninzu yibitabo nkatwe urubyiruko  imana imuhe kuramba arambana ibyo adufitiye ,2
4364,1266,nizere ko icyo gihugu ryubahirizwamo ari kimwe cyo ku mugabane waziya,1
4365,718,ndinde wo kutajyendera mukigare arko ngenzi yarari kwigendera imvura iramunyagira nuko imvura iratoha ,0
4366,1329,jiunge na huduma za kibenki kupitia simu yako ya kiganjani ili upate ujumbe wa sms wa miamala ya akaunti yako na kuwa karibu na akaunti yako popote ulipo,2
4367,2849,kwita ku burezi nimikurire byumwana ni inshingano za buriwese umubyeyi ubuyobozi numuturanyi ni inyungu ku gihugu uburenganzira bwumwana bwubahwe,2
4368,3205,nanjye ngushimiye cyane kuko umusanzu wawe ndawuzi cyane muri kaminuzauzahorane uwo mwete nubutwari,2
4369,1135,kwanini waelimishaji kwenye ndo walewale inamaanisha wengine hawana points mpaka wajirudie haohao,1
4370,2893,uyu munsi muri gahunda umugoroba wumuryango es wa  numuyobozi wimiyoborere myiza  bifatanyije nabaturage bakagali ka kabeza ndetse bagenera ifunguro abana bato       ,2
4371,2575,ibikorwa mu rwanda birivugira he pk rbahostskagame,2
4372,1340,ikibazo cyange ntabwo aricyo guhamagara kuri iyi nimero  nifuzaga ko nabona ubufasha nkabona serivise nkabandi baturage,1
4373,2703,nyuma yo gutwara igikombe cya afurika ku ikipe ya senegal inabonye itike yo gukina igikombe cyisi kizabera muri qatar worldcup ,2
4374,1699,hii kitu nzuri sana nilipata fursa ya kuhudhuria aisee wameboresha sana hud,2
4375,1802,aha se naho bazanjyira ishyamba  ,1
4376,1242,hata useme hello december kwa furaha kiasi gani madeni ya november hayakuachi,1
4377,123,inzangano hagati yimiryango ikaba iravutse maze abana bakahatikira weeee,0
4378,3184,mwakoze cyane gatsibo leaders rwose ibi bizatumwa abaturage batagerwaho ninzara,2
4379,1629,kwa mara ya kwanza wanawake nchini saudi arabia wameruhusiwa kutazama mechi za mpira wa miguu na,2
4380,1121,kama ni bahari ukaoge kama ni shari kaloge,1
4381,2537,abo ku mpera yose yisi bazibuka bahindukirire uwiteka amoko yose yo mu mahanga azasengera imbere yawe zaburi ,2
4382,838,nange byarantunguye kubona igisambo kiriza kuriya hhhhhhhh ubundi abantu nkaba bazava mugihe cyumwijima ryari kandi agatsinda kiracyambaye uniform zigihugu,0
4383,1481,uhuru michezomanchester city mabingwa kombe la ligi,2
4384,1577,habari tunaomba namba yako dm kwa msaada zaidika,2
4385,261,blue tick inakuhusu  watakuletea fedheha hawa siku,1
4386,778,kaduma habari karibu katika kurasa zetu tafadhali tembelea kwenye ofisi zetu kwa msaada zaidi,1
4387,2467,dutabare twese uyu mubyeyi jeanne  murakoze ,2
4388,269,muhaxi mbilo yamina ya vava hi chiefseshh niri khombomunimozambique ,0
4389,847,iyo bazakuzituraho se buriya ntizaba yashaje hari uwo yabuze guhirimanga,0
4390,1256,tujengewe sanamu letu nyama choma festival popote itakapofanyika,1
4391,577,bom domingo hosi yi katekisa wena na njangu wa wena mhunti ya mona  sowetoem casa chokwe ,2
4392,1173,hari umwana wagiye kwingiza  bamusubizayo ngo bari gukingira abafite  kuzamura ubwo mwamufasha iki,1
4393,200,va delela ntlha,0
4394,126,amabyise ya shitani abasate konjye ntakoresha toilet hamwe nasatani ,0
4395,2269,gahunda ni guma mu rugo kuva ejo usibye ku bakerarugendo babanyamahanga,1
4396,393,acha tariqa hai rt lene ka,1
4397,487,bro ananambia kila mwaka lazima aende na familia nje kuenjoiye anaita kula pipi sahivi kaishakata hadi tiketi wanaondoka tardec kwenda uturuki for  days,1
4398,1409,je wajua kuwa watu huzishika nyuso zao aghalabu mara  kwa lisaa limoja basi ni vyema tujali afya zetu kwa kunawa mikono yetu mara kwa mara na maji safi yanayotiririka kwa sabuni au vitakasa,2
4399,1274,ikaze mu kiganiro ukuri tuganire ku myambarire ese kwambara neza ni gute uri kumwe na lily na jolie tuganire ,1
4400,640,nibaza amadiplome bafite ago bayakuye bikanyobera kweligusa ukuri guca muziko ntigushyehhhh ngobitandukanyijeyewe singaye uwavuze ngo umwana we,0
4401,1664,waha umuntu ikaze mu rugo rutari urwawe gute se ben ,1
4402,1710,ahsante kwa taarifa tutaziwasilisha idara husikank,2
4403,559,etienne naramubwiye ngo ntazane umugore yanga kunyumva murashaka ko azakora divorce mwabarezi mwe ,0
4404,1078,watu watakurushia mawe usiwarudishie mawe yakusanye na anza kujenga himaya yako,1
4405,793,prof baregu miaka ya  ujinga umasikini na hofu vilikuwa maadui wa lakini kwasasa ujinga umasikini na h,1
4406,282,oya wazee wa kazi na mwingine yeyote mnaweza kutupatia msaada juu ya speculation pale dse bina,1
4407,1241,he is detached from the reality mental psychosisabavuzi ba rohoimitima bamufasha,1
4408,2477,urumuri rwasimbuye umwijima genocide ntizongera kubaho iki gihugu mwasize ari kibi tuzabaratira ko twasize ari cyiza,2
4409,1107,karibu sana mteja wetu mpendwa mambo mazuri yanazidi kuja na tunaendelea kuboresha zaidi hu,1
4410,1772,umutima ukunda ntugisha inama ntimucikwe ikinamico yo kuri uyu wa kabiri ni h kuri radio rwanda ,1
4411,723,habari yako hatibu shomary kwa kawaida kuna mabadiliko ya mara kwa mara kwenye menyu ya vifurushi vya wateja wote ambapo ni utaratibu wetu wa kawaida kutokana na matumizi ya mteja kwa mteja tafadhali endelea na matumizi ya laini yako kwa,1
4412,2503,afande ni consistent himself  gahunda ni gahunda nta guteshuka ,2
4413,1883,erega kunywa si icyaha ahubwo nusinda uzumve ko wakoze icyaha,1
4414,663,pamoja sana tigo live ittigo love it,1
4415,494,burya mubuzima ntuzemerere chr wawe gusenga bucece  kuko hari igihe aba ari gusaba imana undi mukunzi mushya ,0
4416,1025,kazi iendeleemwendelezo wa alphard ikitoka kwenye rangi kwenda parkibg kwanza kuposha wengine,1
4417,651,kama ccm hawataki tume huru basi watanzania tunaitaka,1
4418,357,kulikuwa na jamaa ambaye alikuwa ni fundi viatu alikuwa sio muongeaji sana muda mwingi alikuwa busy kushona viatu na ku,1
4419,2082,fabric nyuma ya st semester muri engineering dore mu kiruhuko yari yaciye igikuba ,1
4420,2829,igitondo cyiza kuri wowe ushoboye kubona iyi post ibuka gushimira imana ishobora byose inyembabazi,2
4421,560,okay jamani kama mnavyoona tunaendelea kukusanya mafunzo kutoka kwa mtaalamu wetu hii ni weekend ya mahusiano semina na mpa,1
4422,1033,iyi ni tweet anthem ndaq,0
4423,3215,hifashishijwe ikoranabuhanga ku wa mbere amb  yashyikirije umuyobozi wa jamaica sir patrick allen impapuro zimwemerera guhagararira u rwanda muri iki gihugu  ,2
4424,13,famba ni ma range ya wena ,0
4425,625,swa kahle swi komba rirhandzu ra ntiyiso,2
4426,91,senhora atirha hospital privado lani a humaka kona vatwa hiyena vana vayena angava pfumeli vatlanga na vana vanwani   ,0
