,Unnamed: 0,tweet,label
2869,882,iyo uri small fish ura tweeting ukabura reaction nimwe kuri tweet yawe ukagira ngo wayibitse muri draft wibagirwa kuyishyiraho,0
2870,738,hhw zama kuti hlanganisa na yena chomi ya wena face to face unwi tsunduxa hi xikweleti dont give up,2
2871,1412,mkuu wa wilaya akisalimiana na wasanii mbalimbali waliojumuika katika ziara ya makamu wa rais,2
2872,721,ok a chikwembo cha swi vona,2
2873,1694,kama kawaida nitakua nafanya ya mechi ya taifa stars vs algeria,2
2874,246,heeee wenna ni tsiki,0
2875,1364,tar  niliongozana na bw mussa gama mkurugenzi halmashauri ya kisarawe kufanya kikao muhimu cha mashirikiano kati,2
2876,216,hahahaha futseka wena,0
2877,1815,reka tuganire unsubizauwaguh amafaranga k ngo umwana waw bamwit dianegratialilianedivine clarrisse wakwemera,1
2878,1197,amakuru mashya dusenge byigero alfred yakuwe ku buyobozi bwa  gisele umuhumuza agirwa umuyobozi wagateganyo rwanda ,1
2879,1097,ubwoba bwendaga kuntura inyuma ye hirya iriya ,0
2880,1594,jenerali muhammadu buhari anaongoza kwa zaidi ya kura milioni mbili zaidi ya mpinzani wake wa karibu ambaye ni,2
2881,347,raha pfurha ka nsati wamina nthabiseng mashaba ka xokwe ,1
2882,1945,ibintu byinshi cyane umwamikazi wubwongereze kumyaka ye  igihe kinini akimaze ategeka ubwami bw ubwongereza,1
2883,296,eka  teka famba big ,1
2884,1782,msemaji mkuu wa idara ya uhamiaji ally mtanda amesema kuwa passport hizi mpya zinamwezesha mmiliki kupakua application kwenye simu yake ambayo itamsaidia kupata passport nyingine endapo atapoteza aliyo nayo,2
2885,588,oktoba   alizaliwa rais wa jamhuri ya muungano wa tanzania dkt  tunamtakia heri na baraka katika siku yake hii muhimu ya kutimiza umri wa miaka ,1
2886,1207,abadafite akazi bavugire abagafite ngo babongeze imishahara kuko ibiciro byahenze,1
2887,596,na hanha aswina ku kazata a vatsonguana wo thlanga,2
2888,355,tunapenda kukufahamisha kuwa makato ya kila mwezi kwenye akaunti ya akiba ni tsh  tu vn,1
2889,311,ase ubu muramushakahoe iki,0
2890,2595,natwe turagukunda cyane osee uzaze nyuma ya commemoration week turye show kuri friday,2
2891,1765,idi kwa dodoma tafadhali wasiliana na muwakilishi wetu aliyopo nyerere square anapatikana kwa namba    au aliyopo coed eneo la ujasi anapatikana kwa namba   karibu tukuhudumie,2
2892,872,na juhudi za kuusambaza zaidi maeneo mbali mbali zinaendelea  ajira  udereva uboharia uendeshaji mitambo na ufundi,1
2893,1461,asanteni sana kwa kushare post yangu ya jana hatimae nimepata oda ya kitanda dizaini kama ya kile nlichopost jana  oda tu,2
2894,3273,mubyukuri ndababaye ese koko aba bana babayeho bate ese harubitayeho ubux ahazaza tuvuga harihe        ,2
2895,2385,kino gihingwa ngandura bukungu nizereko baba rasta bagiye kugihinga kubwinshi bakava mu kuririmba rege itagitwika ,1
2896,763,a xinkwa lexi xa le missaveni u ndzuluti we tatana hakukombela lililili,2
2897,777,k views in  days tunawashukuru sana raia wa kidijitali na tuendelee kufuatilia cc,1
2898,1354,batuzanire na luckyfire in stead of jcole,1
2899,343,phula minegue ni diwa at ku huma ndzilo ,1
2900,1347,uchambuzi mwalimu akithaminiwa elimu yetu itapanda chati,2
2901,1637,imwe mu mihango ijyanye nubukwe yaba hari uruhare igira mu gusenya umuryango umva ikiganiro cyumuryango hamwe na colette mukandemezo,1
2902,1926,izo watuguriye c mxiuuuum  ,1
2903,514,mkuu wa mkoa wa rukwa afanya ziara na kukagua maendeleo ya ukarabati wa chuo kikuu cha sayansi na teknolojia tawi la rukwa nakuwahamasisha wanafunzi wasome masomo ya sayansisoma zaidi gtgt,1
2904,251,ni agahomamunwa c cg njye mbaza ibindeba,0
2905,298,mkandarasi mhandisi maji wilaya wasukumiwa ndani arusha naibu waziri wa maji jumaaaweso aagiza kukamatwa kwao asema ubabaisha wa watendaji kwenye miradi ya maji sasa umefika mwisho,1
2906,104,nabuzwa niki nukuntu mwakoze inama mutagitanga lift se urumva kurakara bidafite ishingiro,0
2907,1739,sinari namenye impamvu nabonye ari forfait kumbi burya ni uko byayigendekeye,1
2908,428,niba utazi izo cartoon mutunze television vubaha     ,0
2909,2936,kubera izo mpamvu rero akazi kose kafasha mu kubungabunga umutekano karashyigikirwa cyane kagatangwaho nikiguzi uko cyaba kingana kose,2
2910,13,ubaye urumukobwa ufite million  munzu umujura akinjira akagusaba ko mwakora sex cg gutwara ayo amafaranga wahitamo iki,0
2911,2643,gushimafriday ko uyu munsi yabaye icyamamare aline  irene   ,2
2912,581,hipfukile ingo wena,2
2913,2752,abakobwa beza bava aho uzakura umugore tegereza wihanganye,2
2914,35,arko buriya abantu  babyutse bakora unfollow niki babyutse banywa  ego baba ,0
2915,1014,tunafuatilia tatizo lakopole kwa usumbufu uliojitokeza,1
2916,360,kwakundi ujya kumurongo kuri bus wamara gutappinga siyo washakagayou have to wait another hrs,0
2917,400,uko ryaba rishyushye kose ni ugutwika ibaze gutwika umwana ari nta mpamvu ,0
2918,895,wanaume hawapendi mzima mzima wanapenda vipande vipande anna mghwira  ,1
2919,1578,pamoja na kuwa na followers laki mbili awali lakini impression ilikuwa million nne tuleo followers elfu tano tu tuna im,2
2920,502,kwa namna yoyote kama hujawahi kula bata bills sijui utahadithia nini wala bata wenzako,1
2921,294,vijana wamejibana wapate mtaji wa biashara mnawaita machinga ingawa si wote kutoka mtwara mbaya kuliko zote mnavyovun,1
2922,2035,iyi ni inkashi imwe bengamo urwagwa,1
2923,2025,aya iyi tiyo imaze umwanya munini yatobotse ni kicukiro iruhande rwa clinic ubumuntu mwareba uko mubicyemura  ,1
2924,24,nteye akajisho kurukiko rwubujurire muri comments hariyo abantu wagirango ni abahano kumihanda  gusa taifa na karenzi ngo bazakora ejo ,0
2925,729,ni xisela wena njovo ,2
2926,3254,sporo ya twese hamwe ninyavogerwa mu ngeri zose abakuru nabatoya twese hamwe tutisporo ni ubuzima umusiportif wumunsi  ,2
2927,2922,wamugani ubundi wageze kuki twishimire ko twavutse ark tuzirokana akamaro nibigwi byiza muri sosete pe ,2
2928,545,mida hii kwenye xxl clouds fm radio live mandojo na domokaya wakiireview album yao ya taswira,1
2929,1678,mani nonex ni make ,1
2930,158,fissekane ni barcelona yenu  hallamadid ,0
2931,448,gusubika inama ntibihombya ubuyobozi gusa bihombya igihugu muri rusange kandi uwo mu oppoza yoppoza ubuyobozi apana igihugu ntacyo wumvamo,0
2932,1566,isi ya none  inkingo za covid rwot umva icyo abashakashatsi no gukumira indwara zibyorezo bavuga ,1
2933,732,hita byose ubimusobanurira atazongera kugutesha umutwe minimum  minidad maximum  mama wa maxime,0
2934,113,ahu xitwi xizami pap ,0
2935,2260,warangiza ngo mama nyishyura yamafaranga nakugurije ,1
2936,1088,ile royal tour hata haijatoka tushapata wawekezaji wakujenga hotel tatu za kitalii kupitia yenyeweikitoka mbonachato kwa treni,1
2937,1700,abacuruza services bose ariko niko bigenda burya baba bacuruje igihe uwaguze yamaze aryoherwa na service ndabeshye se,1
2938,1164,samia atoa angalizo kuikabili saratani makamu wa rais samia suluhu hassan amesema tatizo la saratani kwa watanzania linaweza kupungua ama kuondokana nalo endapo kutakuwa na tabia ya,1
2939,523,ushingite kuki kubera ko ntawe yabengutse x ngo amugire umugore,0
2940,762,niku yingiseli nile xokwe mozambique dstv,2
2941,909,buriy yashakaga ko mureba itara rijimije,0
2942,1129,hii ni kazi ngumu sana ndugu yangu uliyofanya ya kuwakutanisha watu mbalimbali katika kujadili jambo hil,1
2943,194,nafasi ya kazi kutoka vodacom tanzania bonyeza hapa kusoma zaidi,1
2944,530,rais magufuli aitaka bot kudhibiti matumizi ya fedha za kigeni nchini,1
2945,1650,hahhh ibyo ntibishoboka kuko burya ni kimwe kiba gikora ikindi kiba kiri aho gusa hari ikiganza ikindi,1
2946,1455,twagiye kuri brentford community stadium ese chelsea irakomeza gusigasira umwanya wa mbere tuganire ,1
2947,3172,nukuri uyumuturage arababaye kd ubuyobozi bwacu turabwizeye hakenewe amakuru mpamo umunyarwanda agatabarwa    mudufashe dutabare uyu muturage,2
2948,442,a vavasati va ma mecha ugue v heti wena,2
2949,1400,miaka  iliyobadilisha maisha ya tuliowengi shukurani sana,2
2950,2437,hahahahh reka nicecekere sinjya ntukana gsa ubanza baba batarimo  hhhhh,2
2951,318,ariko abantu barushya nkahaterera iyo bafashe abantu ntibaberekane induru ziravuga ngo  runaka yaburiwe irengero ngo  runaka bamunyuruje  ,0
2952,876,fika pinned ya fazoboya fanyeni uzungu wa retweet tweet ya ndani alafu muje na handle zenu wajomba,1
2953,325,kabisame nilikuwa naingia na viroba naficha kwenye timberland boots zangunikiingia ndani naviweka kwenye glass halafu nakaa kaunta kama boss,1
2954,357,taku endlela naha faka tinambara ta wena ka whatsapp leya xiputukezi,1
2955,42,ese nk abantu bareba tweet yawe ntibanaguhe like  ibu ari amafaranga ibatse yo bayaguha,0
2956,113,ese ni gute inyama zihabwa uburenganzira bwo gukomeza gucuruzwa kandi amatungo akirwara byo gushyingurwa ruhangodistrict ,0
2957,585,john legend  mina na wena,2
2958,1655,kuandika hii historia yangu natumia program ya sauti na maneno kujiandika yenyewe naishukuru teknolojia ya simu yangu ya iphone kwa hali niliyonayo nahitaji msaada katika kufanya kila kitu hakika namshukuru sana mama yangu kipenzi ambaye amekuwa nami bega kwa bega,2
2959,1559,iyo nawakilisha ni best colabo of all time kwa upande wangu haijawahi tokea tena,2
2960,1997,karongi ibibazo birimo ibikorwaremezo inyubako zishaje umwanda byugarije abakorera mu gakiriro     ,1
2961,2143,uvuze ngo ninde usimbura sekamana ,1
2962,1941,mwafashije koko mukampa igisubizo cyikibazo cyanjye nateganyirije abana iwanyu ngeraho akazi karahagarara ndetse na covid yatumye ibirarane byiyongera ,1
2963,543,mu mutwe wawe haranduye chr,0
2964,2471,aha ntacyo tubaveba tubashyigikire tariki  bazadutere gusimbuka tukajya mu bicu,2
2965,289,kila hatua ni muhimu kwa  leo kwa mfano tembea kwa miguu panda basi endesha baiskeli usitumi,1
2966,1662,tunawatakia baraka za eid,2
2967,2130,kingdom of god ministries igiye gusohora album iriho indirimbo zahimbwe na nsabigaba uherutse kwitaba imana ,1
2968,119,show nyingi za kibongo show ikiisha shabiki unachoka viungo vya mwili kuliko hata msanii aliyepiga show,0
2969,114,conforme muswivonaka va timile maguezi khanimambo edm,0
2970,2044,annet rwose aho waguze iki gitekerezo bimeze bite,1
2971,2832,igitondo kiza mwamfura mwe mbifurije gutangira icyumweru neza mugahaha mukaronka mwagukirwe mubyo mukora byose imana izabarinde iki,2
2972,2688,prince boo humura rimwe uzava mu butindi ,2
2973,454,sisi watanzania tumeamua lililokuwa daraja la miti na kamba ambalo lilikuwa likiunganisha wananchi wa mkoa wa rukwa n,1
2974,659,na inasemekana kwa tafiti kuwa kipindi hichoanakuwa na joto saana kuliko vpnd vingine,1
2975,3249,uyu munsi muri  ku bufatanye na  oneun nabandi bafatanyabikorwa hijihihwe umunsi mpuzamahanga wo gukaraba intoki hamwe numunsi mpazamahanga wubwihererero ,2
2976,337,leo huna haja ya kuangaika sana kufikiria cheza namba  tu tukulipe mara  ya dau utakaloweka ndani ya dakika  tu kamp,1
2977,3009,ndashaka guhemba aba follows  bambere twagiye uko ukora follow usige number ya momo muri comment  twagiye  ,2
2978,194,lolgtgt shii manooslowly wa biwa,0
2979,1295,liguecup ubu kandi wabona babishyize kuri solskjaer  ntakorweho utd itashye kuri round ya  ya ligue cup   fm ,1
2980,1375,pitfe imyaka  ndi muremure imibiri yombi kandi ikindi pfite nakazi  ndigushaka ihene nzarya kuri paska ,1
2981,545,if phfukil ah ih se vona swa ku kazata mwina k,2
2982,2050,harya buriya amakwe aremewe muri iyi minsi ra cg nugutegereza imyanzuro yinama yaba ministers,1
2983,691,niku yingiseli nile xokwe mozambique nilo geee kola hansi ka nsinya wa nkanyi dstv   ,2
2984,1535,kufikia usawa wa kijinsia inatubidi kubadili mifumo ya elimu yenye ufanisi inayotoa usawa huduma bora za elimu kwa wote,2
2985,425,habari ahsante kwa kuwasiliana nasi pole sana tunaomba ufafanuzi wa tatizo lako tafadhali mnapata changamoto ganifb,1
2986,981,ilinyareanda kiri aha rwose mwisubireho pee uburimi mu myandikire bugabanuke uziko numvaga muzanyina naho kumbe ni muzankina ,0
2987,2722,mn iyo technics irikunkorera,2
2988,1000,ni ko biri rwose gusa gushishikara ukabona amanota meza ntibivuze ko abakoresha bakurwanira,0
2989,33,famba uya ti fassa ,0
2990,552,they are not ok ndakurahiye niba ntayo barareba ,0
2991,2618,urugo ruhire kuri   umunyamakuru ubikora kinyamwuga may your family be blessed in all ,2
2992,714,mara buti sydney xikwembu ximu nikile ku hlamusela swilo swi nandzika wativa ingi ova kwale,2
2993,187,hahahah u ta rendera,0
2994,1524,ka mkubwa me mdau wako sana wanguvu naomba kujua kidogo kuhusu william anne ambae nimckia alikuwa hack tishio na pia kevin mitnick is an american computer security consultant author and a black hat turned white hat hacker blessed,2
2995,193,niku zw tititi a ni ngueni mina  ,0
2996,1607,umwaka urangire nyabonye aba followers k koko kandi naburaga bake munkorere umuti ndakora follow back ,1
2997,1355,yes indeed buriya bajyanwe na jesus cg ,1
2998,832,ndumiwe koko ngo abantu bajya gushaka imbaraga mu marimbi hahaha,0
2999,1714,habari yako  hongera  tiketi yako ya kucheza jackpot bure ipo tayari kwa sasa tunaomba uingie katika akaunti yako ya sportpesa kwa kupitia tovuti yetu na kuweka ubashiri wako wa jackpot kwa tiketi ya bure tunakutakia kila la,2
3000,134,urayireka ikisararanga ubundi ikikubura da bitabaye ibyo wamara amabuye,0
3001,1389,se kera tucyiga wamuntu wakundaga gusiba ikibaho ubu akora ik ,1
3002,1758,na wao ndio sababu ya mimi kupata matumaini na furaha shukran zangu kwa madaktari wote ambao wamekuwa wakinihudumia kwa tiba tangu utotoni mpaka sasa na wauguzi wote kutoka hospitali mbali mbali za hapa nchini,2
3003,900,kweico kutoka kilimanjaro kazi walizofanya  kuimarisha uchumi ndani ya nyumba na kuwatafutia masoko kuzuia ukatili wa,1
3004,1616,funguka unga mkono mpango kazi wa taifa wa kuondoa ukatili dhidi ya wanawake na watoto,2
3005,744,mimi binafsi hapo ntatafuta kazi nyingine za kufanya dalili ndogo ndogo kama hizo sijawahi kuzipuuza,1
3006,3020,hakurikiraho nubundi igitero batinkumbuyumwana twareranwexburijoro ndamurotaaaaicyazampa ngo tubane,2
3007,65,nikila hicho chakula minyoo yangu ya tumboni inaweza kuzimia kwa kupata mshituko maana ni surprise kwao,0
3008,996,charity tatizo la internet limeanza lini ukiwasha data inakuonyesha alama gani eghh au g na unatumia simu ya aina gani,1
3009,153,wa famba o duwuliwa,0
3010,2952,sh cyaze tujye twemera phone zidufatiye runini ase ubu nari kujya nkora iki ngo bwire ,2
3011,959,man wasanga kuriya imitingito irimo gusatagura igisenyi ari imana irikudushakira inzira ngo twigire munsi yubutaka muyindisi,0
3012,1624,wasifu wa siti binti saad ni kitabu ninachokipenda kuliko vyote hapo kina fundisho kubwa,2
3013,496,mimi nilikiwa na bphysics achemistry na abiologywakati huo huo nina bhistory akiswahili na aenglish nikaamua kwen,1
3014,1554,ahsante sana tunajivunia kuwa karibu na jamii,2
3015,2347,kuko byakozwe muri us duhite tubifata nkibikwiye,1
3016,1786,kurikira ikiganiro cyumuryango kivuga ku buzima bwo mu mutwe nikoreshwa ryibiyobyabwenge mu rubyiruko muri kumwe na colette mukandemezo umuryango,1
3017,1385,iyi niyo kipe ifite izina rirerire mu rwanda kbs,1
3018,1178,ni kawaida mwembe ukiwa uani nyani hawezi tamba,1
3019,488,ina mas wa ma navela,2
3020,235,mu randza xwa mahala ,0
3021,507,jeshi la magereza limeendelea na program za urekebishaji wafungwa kupitia viwanda vidogo vidogo kuwapatia stadi za kazi,1
3022,1440,kumbe tunaifukuzia china kwa wingitushafika bilioni toka milion mpk  milioni tofauti hapo ni m tumepiga hatua kubwa,2
3023,561,ntacyo yize nibyo yitwaga ko yize ubuterahamwe bwarabisibye burundu ,0
3024,3109,niba bawe bgufashihe kubona iyi audio follow me plz i follow back automatically            ,2
3025,687,usho wena neh  ,2
3026,579,chn nukuri woweho ndabona ufite imitekerereze iri poor kbx abahe bandi x erura ubavugeee,0
3027,1572,kua makini kwenye maishahuenda unachokitafuta kipo kwa yule unaemdharau,2
3028,1790,kazi ya bandari sio kuhifadhi mizigo asema mchalaganya mkurugenzi msaidizi wa bandari ya dar es salaam ahmed mchalaganya amesema miongoni mwa majukumu ya bandari kuhifadhi mizigo si sehemu ya majukumu,2
3029,907,arko imbeba ko bazigeragerezaho inkingo mukaba mukomeje kuzica nizishira bizagenda bite,0
3030,928,tatizo lako linafanyiwa kazi endelea kuwa mvumilivutunaomba radhi kwa usumbufu unaojitokezatumia ezypesa na ushinde,1
3031,781,mani girl arambwiye ngo iyambarire byanze  ndacyamusaba another round ndakomeza mbahe ikuru ,0
3032,1339,habari njema kwa mashibiki zangu kwa mujibu wa viwango vilivyotolewa na mtandao wa ngumi za kulipwa wa dunia,2
3033,2404,byiza cyane mama nkunda abato bafite u rwanda ku mutima gushima ukiriho bikaba ubupfura mutashye,2
3034,236,bila malipo ya ziada ili uweze kutazama mechi hii,1
3035,2321,inyuma yo kumusigiti wo mubyahi wihuse ark witwaze agakeka byibuze,1
3036,141,nuko hasuzuguwe umugore ntanubwo ari ugusuzugura ni ugupfobya,0
3037,1026,sinzi uwo numvise avuga ngo umugabo unywa yogati yakwambara na sitiringi ndamubaza ngo sitiringi ni ibiki ntiyansubiza,0
3038,23,kugenda namaguruse bobakaba bajyana nimodoka aho bagiye hose batitaye kubwurwo rugendo ukorungana urumva mwahurirahe,0
3039,1575,namshukuru sana baba yangu babu  bibi mama zangu wote wadogo na wakubwa  shangazi zangu wajomba zangu na binamu zangu pia nawashukuru marafiki zangu wote kwa kunijali na kunionesha upendo wa dhati miaka yote hii,2
3040,109,xitombo xa zaida,0
3041,1574,hahhhh ubwo wowe uri iwahandi rero tubwire nawe twumve wabona hari ukundi mwabyitaga jyewe ndabona mbizi byose,1
3042,1275,abahinzi batabigize umwuga bavuga ko bahinga bavunitse nyamara bagurisha bagahendwa bikabije ibi byakemuka bite,1
3043,795,mungu anakuona wa nay,1
3044,1148,nikiwa njiani naenda kumtembelea mwalimu ambaye alisema hautakuwa na kitu maishani,1
3045,1774,nkubu inkuru nkiyi  iyikora kugira ngo ifashe icyi urubyiruko nyarwanda       rwose hari ibintu nkabona sinzi ,1
3046,300,obuti wa hao yena a reng,1
3047,1286,paul tutawajulisha juu ya zawadi kwa maswali ya jayoendelea kufuatilia ukurasa wetu hm,2
3048,1981,ntabwo nari mpari boss ngo nsome iyo message wabaza abari bahari ,1
3049,601,umisavuta  michezo  mtwara mashindano ya umoja wa michezo na sanaa vyuo vya ualimu tanzania umisavuta kitaifa yameanza kutimua vumbi mkoani mtwara mashindano hayo yamejumuisha vyuo  vya ualimu vya serikali,1
3050,239,kwa mambo kama haya unaweza wacheki magwiji wa hizi kazi hautajuta wataifanya gari yako hile unataka usisah,1
3051,1299,mafunzo ni nyenzo muhimu katika kuleta ufanisi,2
3052,126,ku gama ku humelela mabandido  ,0
3053,644,kwa mara ya kwanza tumetoa chapisho maalum la mwongozo wa ulinzi na usalama kwa watetezi wa haki za binadamu lenye maand,1
3054,2165,nyamara nta kana karimo nabonye bivugwa nabagore nabagabo barengeje diziwiti,1
3055,645,ximixweni madanbveni ni usiku sikunisiku,2
3056,362,ai nyamara uba utubwiye nabi aba papa twirira udusendababoyi ushatse wakwihana   ,0
3057,2490,nawe wabona inyungu zo gukorana na  biroroshye kuko gufungura konti bikorwa mu buryo bwihuse ,2
3058,2696,mugire umugoroba mwiza kdi twibuka gukora follow kwa  na  utibagiwe  tubikore abasweet ,2
3059,1687,umutwe uri kurya iki ma,1
3060,151,wahora niki ko ntanamenye aho wabereye umunsi wumuganura niwo munsi nahuriyemo ninzara iteye ubwoba,0
3061,975,tujye tunemera ko covid  itwik,0
3062,1298,uyu munsi kuwa mbere kuri stade ya kigali ikipe ya police fc yatangiye imyitozo yitegura shampiyona yu rwanda  ,1
3063,3266,hello brothersamp sisters ubu wabasha gukurikirana uko igikorwa cyoguha yamagare yabafite ubumuga   retweet comment and like ,2
3064,282,umubwire uti ko mbona uri mubi nari bwabikubwire,0
3065,231,kisha chuja kutoka tarehe uliyoweka bet yako hadi siku ya leo kisha bofya kwenye mkeka wako ili kupata taarifa kamili za michezo uliyobashiri en,1
3066,1211,iracyariho ngo tuyishyire kumurongo nayo x,1
3067,1714,niba ufite ama unite hamagara tica wimibare ugufolowinga kuri twitter ,1
3068,1013,wamugabowe uge ukora tweet wabanje gusubiza ubwenge mumutwe kuko ndabona ushobora kuba uba wa bubitse mu birenge ,0
3069,1567,nyamara ushaka wandagira ahantu uri gukura ubwenge bwd your right ,1
3070,697,nashidwa kuielewa sheria ipoje naona kama haitendi haki mwanafunzi wa kiume akimpa mimba mwanafunzi mwenzake sheria ina egemea upande mmoja mwanamke anabaki huru mwanaume anatumikia kifungo je kama mwanaume ndio aliyerubuniwa,1
3071,1079,bunge bila maswali na majibu wabunge wabongo kweli watajizuia mtu amuongelee afu acmjibu lolote tutakuwa tumepiga hatua,1
3072,2,hahahahaha ih tipo arrombaram o nhoster  ,0
3073,456,mwihangane kbs mujye mumesa utwenda twanyu twimbere kbs ndambiwe burimunsi kujyenda nucyirwa muri kubera umwanda mugira ahreeee ,0
3074,413,nkuko umubu unyunyuza ikiremwa kirimo amaraso cyose ni nako umukobwa wi kigali yihoma ku cyiremwa cyose gifite amafaranga ibyahishwe,0
3075,1431,ushiriki wa vijana kwenye kilimo ni mkubwa sana nchini rwanda tunawajibika kuwasaidia vijana ili waweze kufanya kilimo cha kibiashara kwa lengo la kuinua kipato chao wenyewe na kuwajengea mazingira ya kukitegemea na si kutengenea ajira pekee waziri mkuurwanda,2
3076,72,kumbe sio serikali tu hadi wadau wengine wa maendeleo hawana imani na vijana,0
3077,3225,saa h nigahunda yo kumva ikinamico kuri  nawe ntigucike ,2
3078,1503,nashukuru nilishapata japo kuna mwana na elimu yake kubwa aliniambia nilichokifanya matokeo ni baada ya miak,2
3079,575,izo nimovi umaziminsi ureba ziri kukongoza ninde wabonye ubundi arwanishumutaka usibye film ya getili,0
3080,1921,none se yamusabye kujya i manchester yamugiriye inama yo kurega bara agahabwa amafaranga ,1
3081,1796,birenze kuba ubuki ubu mukanya ngiye kugenda uganda kampala kbs,1
3082,1895,abasore banjye barashaka kunganya niyo gahunda kuba mozambique itari iwayo yari amahirwe ku mavubi,1
3083,3068,uri hehe ngo duhane inkokora dushirane urukumbuzi rwigihe kirekire ngwino ndahari,2
3084,277,mom dii faz coisa xx eu busy cota mom futseka nkila waku o humi uxi nampfa lexi ja wa yala i love her,0
3085,946,bob kareem tunashukuru kwa maoni na ushauri wako tunapenda kukufahamisha kuwa tumeyapokea ahsante,1
3086,641,ufit ikibazo cyimyumvire woe mhn baby girl ntawe utakunda icyizere yigirira ahubwo uko agikorrsha nibyo bibi,0
3087,159,ariko uziko hari abantu bakora ubukwebashinga urugo bagamije gusenya nkuyu mugore koko yamukorerwa iki ,0
3088,1691,lakini nimmshukuru kwa namna ya pekee mhe rais ndugu ya nurdin hajji kwa niaba ya serikali ya jamhuri ya kenya kwamba mara nyingi tumekuwa tunashirikiana naye na msimamo wangu na wake ni mmoja  mgangadpp,2
3089,295,wasvivona svosvi kopfukiwa hikhanga hi svihlaya lesvi khaaale,1
3090,187,mlipuko na milio ya risasi yasikika katika eneo la  riverside nairobi kenya milipukomiwili mikubwa ya risasi ilisikika na baadaye ufyatuaji wa risasi maafisa wa polisi wamefika eneo la tukio katika jumba hilo ambalo lina hoteli yakifahari na ofisi za kampuni mbalimbali,0
3091,2386,njya nyabugogo urebe mugastata maze ukurikire urimuhanda mpaka nuwuvemo ubwo ibizakurikiraho nyuma simbizi,1
3092,1878,ese   koko nibyo uyu munsi wo kubeshya aba ari day off ya reality ,1
3093,2251,uzi ko ari muri chic koko man      ,1
3094,1792,naibu waziri wa mambo ya nje na ushirikiano wa afrika mashariki dkt damas ndumbaro na katibu mkuu wizara ya mambo ya nje na ushirikiano wa afrika mashariki dkt faraji kasidi mnyepe wamekutana na kufanya mazungumzo na kaimu balozi wa marekani bi inmi patterson,2
3095,782,lubasha nakubaliana na wewe ila sometime huyo uneyemfanyia ubinadamu atatoka na kusema kwa mtu aah hii k,1
3096,127,sheria ya kimila ni kikwazo kwa wanawake kumiliki ardhi mkurugenzi wa,0
3097,478,hosi xikwembo xanga mamba yanga mamba yanga hi yamukeli ,2
3098,360,hi ta ya ka wutomi ,1
3099,323,nonex uwo mwana nago azikubara amafaranga kombona yabishyuraga akibagirwa kuri burimuntu uyumwana yaradamaraye,0
3100,717,ni yingiseli  kola ka doroba laka chokwe    dstv niyo gee na vovo flora mathonsi,2
3101,2064,twe abanyamahirwe dutegereje kumva ko betting zigiye kongera gukora mwe mutegereje iki,1
3102,2306,cyane cyane iyo kumwe nawe,1
3103,645,ese  ngo mucuti wawe neymar ngo asigaye yirarira ku gisimenti ,0
3104,603,mina se lindivarrr mina aita navhela aku teka giyane nitsakisa hi xibelane niri kola a magude ,2
3105,1596,nonese ibyo bibazo byose ntibiri mu byo bigishwa guhangana na byo sinzi niba twumva icyo psychologue clinicien bivuze,1
3106,582,male ya machangana d,2
3107,23,uta ni dhlaya,0
3108,938,benki ya yazindua kampeni ya kwa wateja wake,1
3109,2702,murakoze cyane mwadufasha kumenya aho twakura ubwo bushakashatsi mwifashishije bugaragaza ko kuririmba bivura nyirabyo,2
3110,562,aho gusubira muri za guma mu ntarana guma murugoagasimba kaha akazi abana burwanda   ,0
3111,2243,inkuru irambuye mwayisanga kuri  na bwizatv ,1
3112,158,ntibisanzwe abagabo bafashwe nirari bafatira ku ngufu abagore mu rusengero pasteri areba nawe ushake amafoto ,0
3113,726,kuna dada muhudhuriaji hapa anasema kuwa amezunguka katika kila super market mchicha upo lakini hakuna kisamvu hakipo,1
3114,460,eehsema sista alikuwa anatuwekea msosi kwa siri getosema ndo tunakuta umepoa kinoma,1
3115,1404,aya mafoto murikuyakura hehe,1
3116,926,gusuzugura umuntu mubana murarana ukubyarira abana si ibyo gushyigikirwa ibindi reka mparire inzobere mu rushako,0
3117,1690,aho ndumva ari sawa ariko se ubwo ntimukosha kubera na transport yo kubitugezaho,1
3118,2788,mwabasore mwe mwambabariye mukareka kwangiza ubusugi bwabari burwanda sibyo imana izabaha umigisha myinshi cyane,2
3119,421,jumanne siku ya kimataifa ya sanaa za kuandaa kupika na kula chakula kizuri kwa njia endelevu inakupa vidokezo  vya kupunguza utupaji vyakula na kujiunga na harakati za,1
3120,660,i jabana kabuye uyu muriro ugenda ugaruka ugenda bishobora kuduteza impanuka,0
3121,385,next episode yule mkaka alomshauri chale ovyo tunaomba asimame kuna kiti twataka ona,1
