,Unnamed: 0,tweet,label
1579,637,nawe narekarame ibye nyine kdi niba uriwe ihangane gsa ntukavange amasaka namasakaramentu nitukubwirango udufashe kuyishyura uzabireke  burimuntu numusonga we,0
1580,1131,fahamu kuwa utaongezea tshbahati,1
1581,172,uwani me chamou de marandza ih,0
1582,1215,byinshi ku muti wa buscopan wifashishwa mu kuvura ububabare bworoheje  kigali rwanda ,1
1583,1134,umeshajaza hii survey tunakusanya taarifa za ujuzi na maarifa ya kidijitali kwenye nguvu kazi tafadhali shiriki,1
1584,1671,mangog gura internet yamafaranga ibihumbi  ku mwaka wose uhabwe telefoni yubuntu jyana nibigezweho ,1
1585,488,sina chama sina kadi but napenda nchi yangu ndio mana nimechanga huu nimchango dhidi ya udhalimu na uonevu,1
1586,737,nsuhuje abakobwa bose babasinzi munagire ijoro ryiza  nb ntabe ari wowe utinda kugeza ubu butumwa ku musinzi wawe ,0
1587,534,a wasati vomu taratara jurooo a wasati vomu ghenissa salo a shongaaa  vovo dele ,2
1588,236,yageze kuri noreturning point banzabaramugiriyeyo,0
1589,506,makwezu niko kombelela ka xikwembu a minkateko ni hinkwafswo fi ku fanelaka ti male ma gudi laifi ni mintirho yo tala parabenja  ,2
1590,98,yaaani people are sad kuona wengine wako happy yaani wanachukia kabisa makasiriko ya hali ya juu wamerogwa sijui,0
1591,1466,amakuru mashya minisitiri wintebe wu bwongereza boris johnson ageze i kigali aho aje mu nama ya chogm rbaamakuru ,1
1592,3114,kurikira umuyobozi wa  kuri gahunda ya operation mumizi maze ufashe kubaka u rwanda twifuza           ,2
1593,2063,iri mukazi muze mu muryango mugari wa internet yihuta cyane ,1
1594,1724,tunawatakia wanajukwaa na watanzania wote maadhimisho mema ya kumbukumbu ya kifo cha baba wa taifa mwalimu julius kam,2
1595,2739,ni umubyeyi usirimutse kandi wimfura mwifurije isabukuru nziza,2
1596,450,naomba kuuliza taratibu za kufuata na wapi ambako naweza kusajili au kupata kibali cha kurusha drone camera au kupata mt,1
1597,858,are you invited kwenye listening party ya msanii  nitawasimulia hapa hapa ukali wa ngoma zilozopo kwenye,1
1598,433,umva sheri niba dushwanye kuri whatsapp ntakibazo dufitanye tweeterntugatume data zipfa ubusa ,0
1599,1644,biravugwa live  ibivugwa ku isi yose imirimo ivunanye ikoreshwa abana bari m ,1
1600,1606,ikibazo si ukuba batawukozeho ikibazo ni mouvement bakoze zegera umuzamu kandi already bari muri horsjeu,1
1601,34,uko imana igenda itinda mbona izacyura ubusa     ,0
1602,779,matukio katika picha kuelekea wiki ya azaki dodoma,1
1603,1992,amabwiriza yo hakurya iyo,1
1604,647,dezember time   ku ta fiwa,2
1605,2535,nubwo amagambo yanjye yaba menshi shimwa mana kuko ndamahoro mutima wanjye himbaza iyo mana unezerwe ,2
1606,2873,connectrwanda yageze mu karere ka rwamagana uyumunsi abagenerwabikorwa  barakira telephones nshya zigezweho banahabwe internet yubuntu bazakoresha mu gihe cyamezi atatu goodtogether  ,2
1607,2124,ariko uyu mwana mupfana iki man  wampaye akanimero ke ,1
1608,1773,ahsante kwa uvumilivu wako pole sana kwa changamoto uliyoipata huduma ya internet sasa imerejea tunaendelea kuomba radhi kwa usumbufu uliopata sm,2
1609,889,habari  kifurushi cha internet huwa kinaisha kulingana na matumizi yako jitahidi kupunguza kiasi cha matumizi ya intaneti,1
1610,1695,ase mhn ubu wanguriye nange,1
1611,3049,umva inama ureke izo business ,2
1612,668,dini ni utaratibu tu hata wewe unaweza kuwa na utaratbu wako juu ya unayemuamin na maisha yakasonga,1
1613,741,ariko buriya niyihe mpamvu iyo umuntu amaze kurya ahantu hatari iwaboiwe ahita yumva ashatse gutaha ,0
1614,295,foo uriya mutipe ni umusazi,0
1615,179,ajali za barabarani zaua  kwa siku duniani gt,0
1616,39,aha swa mbangue tsala swi mbeni hloko ya pao,0
1617,1009,tukihitimu tunabeba vyeti na kuacha materials yaliyotupa vyeti vyumbanimaholinikugawakuchana kabisa mule ku,1
1618,3243,wa mugani nyamara  uzi ubwenge urereunze  ,2
1619,2348,ubwo tuzajya twikoreshereza gakondo dore nubundi urukingo ruri kutugeraho gake gake,1
1620,2932,ushatse wowe uzigumire murugo nta kibazo nukuri kugeza urukingo ruje cg umuti bonne chance,2
1621,1529,wanakwambia hiviii usipitwe na muda wa kula bata la uhakika unapotumia au na kuji,2
1622,1939,zeph niyonkuru mwakoz neza ark mugeze kugufata photo mwibagirwa kubahiriza amabwira yo gushyiramo metro nkuko mubidushishikariza  murakoze ,1
1623,2017,amafaranga ahubwo undangire aho aro,1
1624,291,aloku niku im         ya ba buluko,1
1625,3138,u rwanda se koko rwasezerewe muri   ntakundi mwarakoze basore bacu,2
1626,2431,na none bicaye bakemeranya ko umugore afata izo nshingano ntacyo bitwaye,2
1627,71,ark abakobwa bakunda cash narindikumwe na chr ikijyama kimukubita aka message ka momo none ahise ambazango nitwande sha,0
1628,226,hhw sesi famba uya vonana na papa face to face uhlamusela mhaka ya wena papa va rhelela moya,0
1629,2183,bra akora inzoga liakazipfundikira rwa bakazinywa ,1
1630,775,cyze mumbwire kugura subscription kuri dstv ireba imipira arangahe ndebeko izi nyatsi za canal nazivaho kuko impombesheje match inshuro ebyirirwot ,0
1631,616,erega abakobwa siko bose bakunda amafaranga hari nabamwe bakunda ibiyakomokaho nkimodoka inkoko zokeje amafi ninzoga zihenze nibindi nkibyo  ,0
1632,2571,nukoo rero yasuwe wigurire nib aribyoo washakaga inama  sukoo zigirwa,2
1633,301,nina mpango wa kushare skills za drone kwa wanadada ambao watakua na utayari plus passion ili tuwe hata na mapilot wa kike,1
1634,50,swa kharata mpela khambi funtsi a ih swi tsiki ,0
1635,2478,uyu ni umwanya mwiza wo gushimira nyakubahwa perezida kagame washyizeho gahunda igamije gusubiza agaciro umugore mu gihugu cyacu,2
1636,1465,ko ntari kubona code kandi namaze kwishyura frws asabwa biragenda bite  iyi niyo code nishyuriyeho ejo kumugoroba,1
1637,740,u tah yi phuza impala  ,2
1638,2370,oya mu rwanda bavuga bikini wajya kureba ukikanga ,1
1639,579,dzipelile u kone fanhana,2
1640,2211,egoko mbese urumva umugore akwiye kwikora ibyo yishakiye murugo abanamo numugabo wamurongoye,1
1641,622,esh na mina se ni mikuma kahle  niri khombomunimozambiquedankiiiii,2
1642,2345,ubukwe umukobwa tugiye kubana nindi mihango yose ngiyo gahunda nciye impaka kubabimbaza mwese mbahaye rugali ,1
1643,529,hina matxangana vah hi tiva hiku tsaka  ,2
1644,1083,etienne naramubwiye ngo ntazane umugore yanga kunyumva murashaka ko azakora divorce mwabarezi mwe ,0
1645,373,mzigo genuine mzee,1
1646,2136,iki kibazo umuyobozi wakarere yagiyeyo aragikemura uyu muturage ushaka umuhanda nawukenera azabagurira ubutaka bwabo kuko inzira yo arayisanganywe umuturagekuisonga,1
1647,1453,habari ahsante kwa kuwasiliana nasi tunashukuru kwa mrejesho wako endelea kuwa supa na mtandao supa tanzania ahsante jm,2
1648,2350,sinari kurizwa nuko ntatwaye guma guma nari kurizwa nuko abanjye batakindi inyuma  super kemo kemotherapy,1
1649,22,hosi yanga ,0
1650,994,ss hd ss ss na wwe super slam chaneli namba gift,1
1651,1710,icyangombwa nuko abayobozi babitangaje birahagije,1
1652,16,u bihile demais lokhu ulangunta hansi a xikwembo swo kubha i mazwidji ,0
1653,2354,uyu munsi mu tugali twose tugize  urubyiruko ruri mu biruhuko rwahawe ibiganiro muri gahunda ya operationmumizi      ,1
1654,785,ibibintu byaje byogutera imiti ya maralia bimaze kuduteza abaturanyi urabona ngo umwana ansure nasohoye ngobatere kwer ndamubeshya ik koko ,0
1655,238,namina aniswi tivi swaku president mbalula di endle yini,0
1656,1508,premier league ishyize hanze umupira uzakinwa muri season  ni mbere yuko tumenya fixtures nazo zirasohoka uyu munsi ,1
1657,540,taasisi zinahitaji kujiuliza zinataka page za mitandao ya kijamii ziwe kwa ajili gani unaweza kutumia mitandao ya kija,1
1658,211,u tadla biloko ,0
1659,381,wa switiva papa,1
1660,1540,binti akikosea haina budi kumsamehe na kumpa nafasi ya pilihii itaongeza chachu ya kusoma kwa bidii ili kusa,2
1661,252,ni injiji mbi idakenewe muri sosiyete nyarwanda kuki atagaragaje abo bafungiwe ibikorwa naduhe urugero areke conspiracy theory sinika manyo,0
1662,1427,ni isiaka mperereye rubavugafuku nubwo ntafana man united ntirava musiganwa jyigikombe nifanira city gusa umutoza namuha ,1
1663,3200,dr ugirashebuja emmanuel yagizwe minisitiri wubutabera akaba nintumwa nkuru ya leta ni umwanya agiyeho asimbuye johnston busingye ,2
1664,853,hii ni sehemu ya mwisho ya stori ya bi scolastika ngwaluesoni mshindi wa tsh  ambapo anaweka bayana mipango yake soma usisahau wiki hii jackpot inasoma tsh ,1
1665,409,niku khoma nile xokwe mozambique ,1
1666,2544,police yacu ku isonga ndabakunda cyaneeee,2
1667,317,uri ikijuju kdi ibijuju bigoye kubona umweru nubururu wowe rusuferu azakwakire ikuzimu,0
1668,1280,tulitolea taarifa kuna matengenezo katika mtambo wetu wa kufua umeme kwa gesi asilia cha ubungo tunatarajia yatakamilika februari ,2
1669,376,mu byukuri ibintu byanyu byo kwanga kwishyura umuntu amuhaye cheque byaje ryari,0
1670,287,ese kucyi abahungu bicyigihe basigaye bumva ko kuryamana aringombwa wamuhakanira mugahita mutandukana urwo nurukundo koko,0
1671,1415,na ndio maana kujenga barabara hii ni muhimu ili yake magari yatakayokuja kudhughulika hapa mitambo wawekezaji watakaokuja hapa usafirishaji wa madini haya barabara isije ikawa kikwazo  raisjpmruangwa,2
1672,1727,ntkbzo icyingenzi nuko numvise ko nshobora kuba ntecyereza ibijya gusa ni byabandi,1
1673,1441,habari unahitajika kutembelea tawi lililo karibu nawe na kujaza fomu,2
1674,494,kassi hi wena lolita ,2
1675,1356,barakoa hainikingi mimi pekee bali huikinga familia marafiki na jamii inayonizunguka  abby hata kama umechanja,2
1676,229,bwana haya mabegi ni matamu mdm unaletewa popote ulipo,1
1677,610,vanhu va mali ku khola   ressano boarder ,2
1678,2133,biramenyekanye ko icyatumye wa munyamakuru avuga igikoma ngo yarafite irindazi adafite icyo arisomera ,1
1679,2612,murakoze cyane interuro yacu ni ukudatezuka kungamba twiyemeje,2
1680,469,namba yako ya simu duka ulipowasilisha taarifa zako kwa msaada zaidi ahsante oe,1
1681,1137,rip clestin ntawuyirushamabokobtn  isi we ndababaye nshuti yange igendere kbs umunsi ni wawundi ,0
1682,1214,utyo  operation kaberuka na marita ndi kuyinoza,1
1683,2978,kirazira kurera umwana nkuko warezwe muhe agaciro kagezweho nibwo nawe uzaba wihesheje agaciro,2
1684,1020,hii episode  mmeua sana aisee yani unyamama,1
1685,1070,nukuu upungufu wa wafanyakazi ni changamoto ila unafanyaje wewe ndio kiongozi kuitatua changamoto kikubwa kinachohitajika ni uwezo kwa sasa payroll ya watanzania ni zaidi ya watu laki  na ni baada ya kupunguza watumishi hewa rais dkmagufuli,1
1686,911,mama wa mukobwa wawe ntuzamende rwose  ibintu by inkwano uzoroshye da ,0
1687,1248,chuma miquissone anatufungia bao la kwanza,1
1688,1111,ikiganiro cyiza usibye no kuba abo baba babizi hari nubwo abo wizeraga baba ari bo bamusambanya ni hatari,0
1689,288,kenysol naho ahuriye nutwo dupeti tundi ma nigga,0
1690,1839,chelsea inaniwe kongera amanota yo gukomeza kwanikira amakipe bihanganiye igikombe cya epl ,1
1691,558,shirika la umeme tanzaniatanesco taarifa ya maboresho ya miundombinu ya umeme shirika la umeme tanzania,1
1692,1486,ntimucikwe ikiganiro urubuga rwitangazamakuru hrhr ingabo mu butumwa bwamahoro bivuze iki ku gihugu turi kumwe na  na  ,1
1693,69,je wajua imekua ni kawaida kwa watu kufanya mapenzi kinyume na maumbile kisheria ni kosa la jinai na adhabu yake ni k,0
1694,691,nonese ubwo ukurikije igihe iyoburuse yagombaga kuhagerera ubwo uwabigizemo uruhare abaye atarasinzira yaba ataricwa nisereri   marie niwemwiza,0
1695,2819,umwaka wose urashize ndi kuri twitter genda ukore follow dukomeze kubana mu muryango mugari  ni   mugesera kibungo rwanda ,2
1696,1453,cyane gusa nabonye amahirwe bagira bamwe baba bafite imitungo basigiwe,1
1697,489,uvuze neza cyaneiyo kovidi abantu ihitana hari nubwo bajya kwegera abicwa ninzara ndetse nimpanuka munce zitandukanye turababaye,0
1698,1328,nabwo ambassador bapfa kumwica ntibishoboka kereka atagifite iyo nshingano,1
1699,903,ukuntu mba mfite ubwoba iyo ngiye gukaraba mba meze nkumuntu ugiye gusambana bwa mbere,0
1700,3108,urebye kuva za kibiri numunani nibwo twamenye ko tg yaduha umugati lick lick akora beat turirimba street umuhamya   ,2
1701,841,muri equity itm zipfa buri weekend  bk yakuyeho cheque ubu ntakwandikira umuntu cheque  service mbi ,0
1702,1168,jamani mko wapi hawataki kutumbuliwa huku mbona sukumawiki tu zinaondolewa kwenye mboga,1
1703,1861,nagiiye muri congo gusaba akazi murabona barakampa  ,1
1704,1126,habari tafadhali tuandikie changamoto unayoipata kwa msaadagift,1
1705,2352,ladies ese kuki mukunda gutura ibibazo byanyu abasore kuruta abakobwa bagenzi banyu nuko aribo bagira umutima mwiza,1
1706,1252,karibu kwenye wikiendi nyingine ya kuelimika na  tazama ratiba nzima kisha tukutane mapema kesho,1
1707,2963,friendsgahunda ni guma mu karere dukomeze kwirinda ,2
1708,2106,na  mudufashe gufungura umuhanda i kagamba tuhamaze igihe imodoka zafunze umuhanda ,1
1709,1787,rais ametoa bil  ujenzi wa hosptali ya kanda kusini pia hapa isemwe rais anadaiwa bil  za wakulima wa korosho,2
1710,1405,tunaposema tunazungumzia kazi kubwa ya kuhamasisha wanawake kuwa viongozi kuanzia mwanamke mwenye miaka ,2
1711,554,hello sisi ni kombela round ,2
1712,2406,afite amahirwe yo kuba abasha kwerekana anarangamutima ye urwo rugerero uvuga azarugeraho ari strong mu mutwe kurusha uko ubitekereza,2
1713,1759,abafashamyumvire muri urujeni bahawe imfashanyigisho zizabafasha gusobanurira neza abangavu ubuzima bwimyororokere  ,1
1714,3259,bnbsports gahunda yimikino ya  cyirangiza cyigikombe cyamahoro rayon sports izakira bugesera fc ku itara simplysports ,2
1715,279,uhum  evita ya ,0
1716,1363,waziri wa sera bunge kazi vijana na ajira jenista mhagama leo februari  amezindua mfumo wa kisasa wa ma,2
1717,1219,muraho ese birashoboka ko umuntu yabona urutonde rwabantu biyandikishije gukorera impushya zo gutwaribinyabiziga mumwaka wa  mukarere ka  mukwezi kwa ,1
1718,392,iki x mugire mushake mutuvire aha ,0
1719,2628,friendsmureke tube banyamutegera akazaza ejo kuko ntawumenya icyo ahazaza hahatse rero kugira neza tubigire intero ibe ninyikirizo uwiteka abarinde,2
1720,2565,nimuze dufatanye gusura ibyiza bitatse  ku igare hamwe na   ,2
1721,2676,true ikindi ni uko uwakingiwe iyo virusi imufashe itamuzahaza nkutarakingiwe,2
1722,1810,arubtre se nawe arimo gukinira guinea,1
1723,1319,uyu munsi kandi ubugenzuzi bwakozwe muri hotels na restaurants twari kumwe nitsinda ryabaganga  barimo gupima covid         ,1
1724,1311,wanafunzi wa shule za sekondari simiyu na biashara wakipata elimu ya umuhimu wa matumizi wa taarifa za hali ya hewa kwa,2
1725,405,afite akazi katoroshye byibuze abe ari imburamukoro nibwo byiza kurushaho kuko nta munyakazi uba kuri uru rubuga,0
1726,2280,why not si abana babo yamukikira cg agateka ntabwo bireba umugore gusa,1
1727,19,kubona aba followers hano bigoye kurusha uko wabona imbwa y umutuku cg amahoro muri rayon sport ,0
1728,2339,ariko numvise basesengura ngo suluhu afite political caliber nto twizere ko iyi myaka isigaye azayihambiraho ntihabe icyuho mu miyoborere,1
1729,1163,wowe urareba mission ntabwo ureba ikiba kimujyanye biterwa ninshingano aba akwiye kuzuza ,1
1730,278,basibye logo ye bas shyiraho ibyabo kandi niwe wakoze iyi photoshop kuko uriya mugore yari yenyine,0
1731,1775,thank you pipimoyo and shemela karibuni tena nawapenda,2
1732,139,hawena hinga ni tsika pah ,0
1733,1472,mungu tusaidie mafirstborn wote amen,2
1734,951,ushatse kuvuga ko gupostinga ibiryo ari ibyabagore se iyo myumvire izabavamo ryari ,0
1735,501,u ta mu vona lu lala nyana x ku vi a d ti nga txayi  ,2
1736,567,asante kwa ufafanuz ila waswahili ndo wanapswa kupewa kipaumbele kuliko mataifa mengine,1
1737,1202,ba bapolisi bashatse bakwitahira,1
1738,1965,ese koko ubukene buvugwa mu bitangazamakuru byo mu rwanda bwaba bubangamiye ubunyamwuga bwabanyamakuru,1
1739,591,hi pfhukile a va tsongwana va thlanga khanimambo ho yini kupfhuka,2
1740,2034,baba baratugize rd parent,1
1741,1683,tunapenda kukufahamisha kuwa ili uweze kufanya malipo na manunuzi mtandaoni utatakiwa kutembelea tawi letu lililo karibu nawe na utajaza fomu ya purchase online vicky,2
1742,1155,nones rata imvura namwe muri kuyumva ko iri gutonyanga,1
1743,129,nikakimbia na mmkufika mbele naona kuna watu wengine wako busy kabisa hawana hbr nkawauliza vp kulikoni wakanambia dogo hapa ni kama libya au southmda wwte machafukoww kimbikimbia bila sababu tutakukuta kituoni,0
1744,2168,uburinganire ntuzi icyo ari cyo ni yo mpamvu uri kuvuga utyo ,1
1745,2791,nukuri ubufatanye bwabanyarwanda bwahozeho kuva kera nakare kandi imana izabibahemberamwakoze,2
1746,491,je wajua binadamu mwenye kilo  ana lita  za maji katika mwili wake lita  ndani ya cell na lita  nje ya cell,1
1747,1386,nchi ya tanzania na afrika kusini ni washirika wakubwa wa uchumi na maendeleo,2
1748,2690,mu muhango wo kwerekana abakinnyi ba  uri kubera i shyorongi hahembwe umukinnyi muto wumwaka akaba ari ishimwe pierre ,2
1749,3282,ese ubu hari icyo  itakoze noneho ubu ushobora guhera mugitondo ureba filme ukageza ikindi gitondo nta guhagarara na unlimitedpark rwose ,2
1750,463,naibu waziri wa mambo ya ndani ya nchi mhandisi hamad masauni amewataka watanzania kuweka fedha zao katika benki za kiislamu zilizopo nchini ambazo hazina riba ili ziwasaidie katika mafanikio mbalimbali,1
1751,1139,uzi mbona km bado ujajitoshleza km ulivooanza khs khsu kvp alivujisha taarifa kwa mwamba mpk kuishambulia marekani hapo ndo nilikuwa nacbir,1
1752,1581,mkuchika kila mmoja ana jukumu la kupambana na rushwa,2
1753,1627,kundenga ha tunapenda kukufahamisha kuwa tumefanya maboresho kwenye menyu zetu za vifurushi kwa kuongeza ujazo wa dakika sms na mbs za internet fahamu utaweza kupata vifurushi vyetu kwa bei ya chini kabisa kwanzia shilingi  n,2
1754,355,ikibazo kiri mu mitangire ya mubazi kibaganisha ku rupfu ni ikihe ,0
1755,105,huu ni uhuni wala mama hakuagiza hayambona hizi oparesheni zinaweza kufanyika kiustaarabu tusio kila kitu cha kutumia nguvu,0
1756,112,mbona hivi vidonge vimeadimika hv kwann maana wagojwa wa ulcers wanapata tabu,0
1757,154,kwa kundi abakobwa bateye nabi bitera ibirungo byinshi gtgtgtgtgtgtgtgtgtgtgtgt ,0
1758,497,nawe rero urahuzingo wemejumwana kumbi naguziko yamaze kukubara,0
1759,2879,ubwongereza bwakatishije itike yo gukina umukino wanyuma wa euro nyuma yo gutsinda bigoye ikipe ya denmark  yayibanje igitego final ita vs eng isangosport isango ,2
1760,177,xitombo xa wanku,0
1761,1093,akarere ka  umurenge tumba akagari ka gitwa umudugudu berwa habaye kwangirika kwitiyo yamazi bityo amazi ari kumeneka ku buryo bukabije   tabara ,0
1762,3083,oya nukuri ni yo mfite,2
1763,840,inkuru yuko agathe uwiringiyimana wari minisitiri wintebe yishwe urwagashinyaguro ningabo za far soma hano inkuru irambuye  ,0
1764,1258,hari email batanze one day wayireba ngo ukabandikira,1
1765,2085,olivier bayizere afite bingahe ubu,1
1766,1747,mpakurangire uri ready kunywa kamwe se,1
1767,649,sinavuga ko wampambiriye kuko wampaye ama ide none dore indege zosezi kigali zose zansariye  its okay nubundi nararompetse its okay  ,0
1768,2707,nimuyindemere rero dore ni umunsi wanjye,2
1769,3052,umwaka mwiza muhire denyse nawe uzakubere uwumugisha,2
1770,1612,ubarikiwe sana bro kwa moyo wenye hekima na busara hakika mungu atakupa zaidi ya hapa,2
1771,2468,rwot waha iki  yashyizeho gahunda nziza kandi ihamye yo kuvurira ubuntu abarwayi bumwijima hepatitis c  ,2
1772,1143,babra alimpigia simu diamond na kumwambia mtu pekee anayetakiwa kutajwa kwenye wimbo wa simba ni mo peke yake diamond alik,1
1773,1949,amakuru agezweho perezida wa repubulika paul kagame amaze kugera muri zambia aho atangiye uruzinduko rwakazi rwiminsi ibiri rbaamakuru ,1
1774,2547,inzira yanyuzemo nyamara nawe wayinyuramo ugasezerera ubukene,2
1775,106,nitaku panhula hi xikwe xa tiro l  ,0
1776,1083,wingi wa vidonge pia kila siku kunywa vidonge sio poa ndio maana mataifa yaliyoendelea wametengenza kidonge kimoja kw,1
1777,332,yiiiii akumva yagusebeje rwose yakukubabaje ukugirango abantu bari bazi ko umubiri wawe udakora  so stupid,0
1778,1261,je unamfahamu kijana yeyote ambaye ana tatizo la afya ya akili,1
1779,349,sha niyo nabikora ubwo icyaba gisigaye cyabarisasu,0
1780,432,karingana wa karinganajos craveirinha,2
1781,1262,af ndio inanoga mzee juma halali damu inaflow kichizi,1
1782,25,nimyaka yose umaze waranze kubikora ,0
1783,388,niku khoma nile xokwe dstv,1
1784,1685,ndumva iyomvura arinkimwe yo kubwa nowa,1
1785,1180,oya sha nukubura uko ngira ,1
1786,424,kugeza ubu icyo wita ikinyoma nturagitangira ibimenyetso,0
1787,1243,hahaha merci beaucoup  nza ahantu ha mbere nageze nkatitira  kubera imbeho ngiye kwiga muri college umpe amata ngotomere,1
1788,1475,nuko wabuze uko ugira,1
1789,1414,iyo profile si wowe se,1
1790,1783,iyi mihanda ni ibintu byose muana,1
1791,2651,ntabwo kwisiramuza birinda umwanda gusa bigabanya na risike zo kwandura za ndwara,2
1792,572,umushyitsi akagusura ukamuha ibyo kurya akabyanga  nkaho aba yabihashye,0
1793,952,hahahhawarabamenye uriya muhungu satani bamurenganya kubi nkaho bo ari shyashya,0
1794,2724,urukundo ineza ababyeyi banyu bacu babatoje bitubere urugero kuri uyu munsi ,2
1795,2588,good nibyingenzi cyane kugezwaho ishusho yakrere muri rusange welcome ,2
1796,3111,habwa umugisha nawe mwenimana nyagasani agusekere akwereke ineza ye,2
1797,717,baza toussaint ba nkotanyi bankaraga passe zibisazi nkakatura  fit by saint ft ,0
1798,1151,rwanda police taekwondo club yegukanye gmt  ,1
1799,212,winyibutsa ukuntu nigeze kurya ingurube nyita inkoko kuberako nasanze byari muri package imwe naho inkoko zashize nkejo,0
1800,557,gutera ivi ntabwo mbishyigikiye ntanubwo nakemera ko barinterera ese ko wabigize intambara  ntabwo napfukama mbisubiremo ntabwo napfukama tu,0
1801,669,my lil nephews wanapelekwa kirahisi shule yaani wanatoka nyumbani saa mbili kasoro shule wanatemb,1
1802,2706,iki gihe naringikeneye cyane  webare kumpa umwanya nkabana namwe nishimye cyane  uri inkotanyi cyane inkotanyiniubuzima ,2
1803,3030,umva mbese wowe fata turuwasa zawe uzishore neza urebe ko utazagafata tukumirwa,2
1804,2138,ewan numusirikare wo kubutaka kbs,1
1805,1170,ya wazalendo waadilifu waaminifu wachapa kazi utalii wa utamaduni ,1
1806,320,niku vonile na nifamba hi movha ani jahile niku vone ka nkuna ka palmeri,1
1807,1255,kipanya ni genius ni basi tu shujaa hakub,1
1808,2596,merci lydie ibyiza byose unyifuriza nawe bikugereho ndagushimiye cyane,2
1809,940,usibye nikimwaro numuvumo ntuzabavaho rwose bararuhira ubusa icyasha cyamaraso yinzirakarengane ntigisibangana ,0
1810,1490,gucoca amakimbirane hagati yabashakanye niyo nsanganyamatsiko uyu munsi iganirwaho mu kiganiro urubugarwitangazamakuru ubona hakorwa iki tanga ibitekerezo ,1
1811,2577,true amafaranga si ibintu byo kunyanyagiza nimporte comment,2
1812,1682,habari minshock tafadhali tembelea tawini ujaze from uweze kuwezeshwa na huduma hiyobl,2
1813,293,abanyeshuri  mu bakora ikizamini cya leta muri kigali barwaye covid ,0
1814,1356,isiyanone isesengura ku matora ya perezida wu bufaransa ni h kuri radio rwanda hamwe na  ,1
1815,288,huko makao makuu dodoma nbs mtakwimu mkuu wa zanzibar   wamezindua chapisho muhimu kuhusu takwimu,1
1816,893,kuva mu kwezi kwa kane udahemba umuntu  ese wumva abayeho ate   mukwiye gucibwa indishyi nibihombo muba mwateye abanyarwanda,0
1817,1145,uko mwayitsinze ntanumwe utabizi se mugabanye umwijuto dore twagarutse kukibuga tubamwaze ndebe aho abasifuzi na etoo bazahera,0
1818,534,abantu batukana baba bagaragaza intege nke muguhangana kuko umuntu ntiyemezw ningano yibitutsi wamututse ndabashimiye,0
1819,3000,tugire umutekano buriwese abe ijisho rya mugenzi we dukumira icyaha kitaraba dutangira amakuru ku gihe kandi vuba   ,2
1820,1615,siri kubwa ya taasisi yoyote kukua ni kufanya kazi vizuri ukifanya vizuri watakuja wadau wengine kukufund ili wazo lako liwe,2
1821,747,ikipe ifite ibibazo se wayitsinda uri nde,0
1822,1271,hakorwa iki ngo ubukene bugaragara cyane cyane mu cyaro buranduke burundu,1
1823,1408,rais akivuta utepe pamoja na balozi wa china hapa nchini wang ke kuashiria ufunguzi wa maktaba mpya ya chuo kikuu cha dar es salaam yenye uwezo wa kuchukua wanafunzi  kwa wakati mmoja wengine pichani ni viongozi waastaafu mbalimbali kutoka nchini tanzania,2
1824,2561,urwego rushinzwe amazi ruzafate ingamba zifatika kumazi agana mumurenge wakabtwa bashyireho imashini zifite imbaraga zo gukurura amazi ziyegereza abaturage,2
1825,2888,kristo yazanywe no kugira ngo tubone ubugingo nubwo waba warasubiye inyuma mugarukire luka   kigali rwanda ,2
1826,1122,taarifa na ikufikie ewe mzazimlezi kuoa au kuoza binti mwenye umri mdogo ni kosa kisheria utakamatwa,1
1827,300,habari ndugu black pole sana kwa changamoto hiyo ondoa shaka tutakuhudumia tafadhali tutumie namba yako kwa upande wa inbox yetu ili tuweze kuangalia kwa upande wetu ab,1
1828,1546,dukorera muri ya kiriya gicupa kinini cya coca kiri iruhande rwo kwa rubangura muhirwa building umuryango wa  murakoze,1
1829,862,amahirwe menshi nuko yaba ari  kuko ejo yarengeraga ndimbati nkufite uburambe mugutera inda ,0
1830,399,ugenini mgeni unatumia kinywaji gani mimi pepsi moja baridi halafu kwanza nipeni chaja wakati huo dagaa zipo jikon,1
1831,1308,nonese djadja wagiye guhagarara munsi ya city tower mubiki,1
1832,132,cyane rwose kuri bo twahora dushwana cyane ko guhunga kwacu no gupfa kwacu byo bitabarwa nabo,0
1833,1559,stakabazi na taasilimu nkuko taifa akunda kubivuga,1
1834,1999,ntabwo byavamo keretse umubyeyi wabo yiyunze na irene naho ubundi abafiteho inshingano kurusha undi wese,1
1835,1328,mnajitahidi sana kiukwelizoezi likikamilika mtawapunguzia kazi maafisa uhamiaji maana taarifa za mtu na,2
1836,66,arkox inkoko izsrwana ninkoko nimurangiza muvugengo iyo nkoko irarenze mwage mureka kureba hafi koko mukareba kure,0
1837,780,nghoma ya nghena ma onha mhaka  a mosambiki va cina hinoooooo tag nghena miva rungula  moamba maputo mozambique ,2
1838,744,mita phaka draw ku tava lucky,2
